{
  "bundlerMatrix": {
    "bundlers": [
      {
        "adapter": "@tonoizer/mfdoctor/vite",
        "id": "vite",
        "status": "supported"
      },
      {
        "adapter": "@tonoizer/mfdoctor/vite",
        "id": "rolldown",
        "status": "partial"
      },
      {
        "adapter": "@tonoizer/mfdoctor/rspack",
        "id": "rspack",
        "status": "supported"
      },
      {
        "adapter": "@tonoizer/mfdoctor/rsbuild",
        "id": "rsbuild",
        "status": "supported"
      },
      {
        "adapter": "@tonoizer/mfdoctor/webpack",
        "id": "webpack",
        "status": "supported"
      },
      {
        "adapter": "@tonoizer/mfdoctor/modern",
        "id": "modern",
        "status": "partial"
      },
      {
        "adapter": "@tonoizer/mfdoctor/nuxt",
        "id": "nuxt",
        "status": "partial"
      }
    ],
    "localCi": [
      {
        "bundler": "vite",
        "coverage": ["Vite 8", "ESM config", "manifest", "stats", "production"],
        "fixture": "examples/mixed-federation/host-vite",
        "id": "vite"
      },
      {
        "bundler": "vite",
        "coverage": ["Vite 5", "CommonJS config", "async ESM bridge", "manifest", "production"],
        "fixture": "examples/compatibility/vite-cjs",
        "id": "vite-cjs-v5"
      },
      {
        "bundler": "vite",
        "coverage": [
          "Vite 8",
          "Nitro 3",
          "React SSR",
          ".output/public client artifacts",
          ".output/server SSR artifacts",
          "production"
        ],
        "fixture": "examples/compatibility/vite-nitro-react",
        "id": "vite-nitro-react"
      },
      {
        "bundler": "rspack",
        "coverage": ["Rspack", "Enhanced", "manifest", "stats", "production"],
        "fixture": "examples/mixed-federation/remote-rspack",
        "id": "rspack"
      },
      {
        "bundler": "rsbuild",
        "coverage": ["Rsbuild", "nested manifest path", "production"],
        "fixture": "examples/mixed-federation/remote-rsbuild",
        "id": "rsbuild"
      },
      {
        "bundler": "webpack",
        "coverage": [
          "Webpack",
          "CommonJS adapter",
          "two federation plugin instances",
          "per-instance artifact ownership",
          "production"
        ],
        "fixture": "examples/compatibility/webpack",
        "id": "webpack"
      },
      {
        "bundler": "vite",
        "coverage": [
          "Vite 5",
          "ESM config",
          "two federation plugin instances",
          "per-instance manifest and stats ownership",
          "production"
        ],
        "fixture": "examples/compatibility/vite-multi-instance",
        "id": "vite-multi-instance"
      },
      {
        "bundler": "rspack",
        "coverage": [
          "Rspack",
          "Enhanced",
          "single-instance adapter",
          "manifest",
          "stats",
          "production"
        ],
        "fixture": "examples/compatibility/rspack-adapter",
        "id": "rspack-adapter"
      },
      {
        "bundler": "rsbuild",
        "coverage": ["Rsbuild", "single-instance adapter", "manifest", "stats", "production"],
        "fixture": "examples/compatibility/rsbuild-adapter",
        "id": "rsbuild-adapter"
      },
      {
        "bundler": "modern",
        "coverage": [
          "Modern.js adapter",
          "Rspack lifecycle",
          "production",
          "App Tools blocked: lockfile trustPolicy no-downgrade (last provenance 2.63.3)"
        ],
        "fixture": "examples/compatibility/modern",
        "id": "modern"
      },
      {
        "bundler": "vite",
        "coverage": [
          "Nuxt module adapter",
          "vite:extendConfig",
          "Vite-under-the-hood production emit"
        ],
        "fixture": "examples/compatibility/nuxt",
        "id": "nuxt"
      },
      {
        "bundler": "vite",
        "coverage": ["Vite Plus", "Rolldown emit lifecycle", "closeBundle post-emit", "production"],
        "fixture": "examples/compatibility/rolldown",
        "id": "rolldown"
      }
    ],
    "partial": ["rolldown", "modern", "nuxt"],
    "source": "./fixtures/compatibility-matrix.json",
    "supported": ["vite", "rspack", "rsbuild", "webpack"]
  },
  "commands": {
    "baseline": {
      "description": "Generate, update, or prune a finding fingerprint baseline.",
      "network": false
    },
    "capabilities": {
      "description": "Print this machine-readable CLI discovery contract.",
      "formats": ["json"],
      "network": false
    },
    "check": {
      "description": "Analyze one project and apply its finding policy; --require-complete turns incomplete evidence into a policy failure.",
      "formats": ["terminal", "json", "sarif"],
      "network": false
    },
    "compare": {
      "description": "Diff deployed MF manifests for name, exposes, shared, publicPath, and remoteEntry.",
      "formats": ["terminal", "json", "sarif"],
      "network": true
    },
    "federation": {
      "description": "Analyze explicit project facts or a discovered workspace; --require-complete turns incomplete evidence into a policy failure.",
      "formats": ["terminal", "json", "sarif"],
      "network": false
    },
    "help": {
      "description": "Print CLI usage and command guidance.",
      "network": false
    },
    "probe": {
      "description": "Validate a deployed manifest and optionally its remote entry.",
      "network": true
    },
    "prompt": {
      "description": "Print offline fix prompts from a saved report.",
      "network": false
    },
    "rules": {
      "description": "Print built-in rule metadata or one rule.",
      "network": false
    },
    "runtime": {
      "description": "Correlate a runtime trace with local project facts.",
      "formats": ["terminal", "json", "sarif"],
      "network": false
    },
    "workspace": {
      "description": "Discover project facts and gate a federation workspace; --require-complete turns incomplete evidence into a policy failure.",
      "formats": ["terminal", "json", "sarif"],
      "network": false
    }
  },
  "completeness": {
    "check": "One-project offline analysis of config, imports, and on-disk artifacts; weaker without emit/manifest facts.",
    "emit": "Post-emit adapter facts (manifest, stats, emitted assets) when mfdoctor runs in the bundler after build.",
    "probe": "Explicit deployed-manifest validation and optional remoteEntry HEAD; never downloads or executes remote JS.",
    "runtime": "Offline correlation of a user-supplied Observability export with local project facts; never fetches URLs from the trace.",
    "workspace": "Cross-project federation gate over discovered .mf/doctor/project.json facts; does not invent missing emit evidence."
  },
  "exitCodes": {
    "0": "success",
    "1": "policy-fail",
    "2": "usage-or-incomplete-analysis"
  },
  "formats": ["terminal", "json", "sarif"],
  "githubAction": {
    "name": "workspace-federation-gate",
    "pinToTag": "Pin uses: to a release tag (for example @v1.1.0). Do not pin to @main for production workflows.",
    "uses": "tonoizer/module-federation-doctor/.github/actions/workspace-federation-gate"
  },
  "networkPolicy": {
    "networkCommands": ["compare", "probe"],
    "offlineByDefault": true,
    "probe": {
      "blockPrivateLinkLocalMetadataHosts": true,
      "defaultMaxBytes": 2097152,
      "defaultTimeoutMs": 10000,
      "httpAllowedForLoopbackInitialUrl": true,
      "httpsRequired": true,
      "maxRedirects": 5,
      "neverExecutesRemoteEntry": true,
      "rejectEmbeddedCredentials": true,
      "ssrfProtection": true
    }
  },
  "nonGoals": [
    "HTML report UI or interactive web dashboard",
    "In-browser mfdoctor runtime agent or client-bundle injection",
    "MCP server schema or tool surface",
    "General --fix autofix for arbitrary findings",
    "No network command (including compare and probe) unless explicitly requested",
    "Unsolicited suppressions or auto-waiving findings",
    "Scraping private Module Federation plugin internals",
    "Runtime-only Module Federation without a bundler MF build plugin"
  ],
  "nonInteractive": {
    "commands": {
      "check": "mfdoctor check --ci --format json,sarif --diagnostics-dir .mf/doctor/diagnostics",
      "discover": "mfdoctor capabilities",
      "prompt": "mfdoctor prompt --finding <ruleId> .mf/doctor/report.json",
      "stdout-json": "mfdoctor check --output - --no-write"
    },
    "flags": [
      "--ci",
      "--diagnostics-dir",
      "--diagnostics-prompts",
      "--format",
      "--no-prompt",
      "--no-score",
      "--no-write",
      "--output",
      "--require-complete"
    ]
  },
  "operations": {
    "commands": {
      "baseline": {
        "arguments": [
          {
            "description": "Baseline operation to perform.",
            "name": "action",
            "required": true,
            "type": "enum",
            "values": ["generate", "update", "prune"]
          },
          {
            "description": "Saved mfdoctor report; defaults to .mf/doctor/report.json.",
            "name": "report-path",
            "required": false,
            "type": "path"
          }
        ],
        "description": "Generate, update, or prune a finding fingerprint baseline.",
        "errorCodes": {
          "invalid-report": {
            "description": "The supplied report is not a valid mfdoctor report document.",
            "exitCode": 2,
            "fix": "Pass `report.json` from `mfdoctor check` or adapter emit, not `project.json`. Re-run `mfdoctor check --format json` to write a fresh report."
          },
          "io-error": {
            "description": "A required local file or output artifact could not be read or written.",
            "exitCode": 2,